<?xml version="1.0"?>
<level xmlns="http://games.smeanox.com"
       xmlns:xsi="http://www.w3.org/2001/XMLSchema-instance"
       xsi:schemaLocation="http://games.smeanox.com lvlschema.xsd">
    <description>Level 5</description>
    <camera min_x="-6" max_x="11" start_x="0" />
    <hero start_x="-23" start_y="-11" dest_x="4.75" dest_y="13.25"/>
    <!--<hero start_x="14.75" start_y="-10" dest_x="28.5" dest_y="8.5"/>-->
    <platforms>
        <platform id="98" x="-27.3" y="0" width="2" height="30"/>
        <platform id="99" x="32.3" y="0" width="2" height="30"/>
        <platform id="100" x="2" y="-15.4" width="70" height="1" type="oldschool"/>

        <platform id="1" x="-16.25" y="-15" width="20.5" height="2.5"/>
        <platform id="2" x="-14.25" y="-10" width="10.5" height="0.5"/>

        <platform id="3" x="-18.25" y="-13" width="2.5" height="0.5" moving_enabled="true" start_y= "-10" end_y="-14" hold_time="0.001" moving_velo="6.2"/>
        <platform id="4" x="-15.75" y="-12" width="2.5" height="0.5" moving_enabled="true" start_y= "-10" end_y="-14" hold_time="0.001" moving_velo="6.2"/>
        <platform id="5" x="-13.25" y="-11" width="2.5" height="0.5" moving_enabled="true" start_y= "-10" end_y="-14" hold_time="0.001" moving_velo="6.2"/>
        <platform id="6" x="-10.75" y="-10" width="2.5" height="0.5" moving_enabled="true" start_y= "-10" end_y="-14" hold_time="0.001" moving_velo="6.2"/>

        <platform id="7" x="-3" y="-13" width="1" height="0.5" type="destr"/>
        <platform id="8" x="5" y="-12" width="1" height="0.5" type="destr"/>

        <platform id="9" x="11.25" y="-14" width="2.5" height="4.5"/>
        <platform id="10" x="14.75" y="-64" width="4.5" height="104.5" moving_enabled="false" end_y="-44.75" hold_time="10"/>
        <platform id="11" x="14.75" y="-12.9" width="4.5" height="4.5" moving_enabled="false" end_y="-30" moving_velo="10" hold_time="10000"/>
        <platform id="12" x="18.25" y="-14" width="2.5" height="4.5"/>

        <platform id="13" x="10.75" y="-9" width="2.5" height="0.5" moving_enabled="false" start_x="7.25" start_y="-6" end_x ="10.75" end_y="-9" hold_time="0.3" moving_velo="2"/>
        <!--<platform id="14" x="9" y="-5" width="2.5" height="0.5" moving_enabled="false" start_x="7.25" start_y="-3.5" end_x ="10.75" end_y="-6.5" hold_time="0.3" moving_velo="2"/>-->
        <platform id="15" x="7.25" y="-1" width="2.5" height="0.5" moving_enabled="false" start_x="7.25" start_y="-1" end_x ="10.75" end_y="-4" hold_time="0.3" moving_velo="2"/>

        <platform id="16" x="0.25" y="2" width="4.5" height="0.5"/>

        <platform id="50" x="3.25" y="11.25" width="4.5" height="2.5"/>
        <platform id="51" x="3.25" y="8.75" width="8.5" height="2.5"/>
    </platforms>
    <buttons>
        <button id="1" x="-0.5" y="2.75" width="1" height="1">
            <toggle_interact dest_id="11" />
        </button>
        <button id="2" x="24.5" y="-14.5" width="1" height="1">
            <toggle_interact dest_id="13" />
            <toggle_interact dest_id="15" />
        </button>
        <button id="3" x="14.75" y="-11.25" width="1" height="1">
            <toggle_interact dest_id="10" />
            <toggle_interact dest_id="13" />
            <toggle_interact dest_id="15" />
        </button>
    </buttons>
    <waters>
        <water id="1" x="2" y="-15.1" width="16" height="2"/>
    </waters>
    <actors>
        <actor id="1" x="3.25" y="13.5" width="2" height="2" texture="sign" collision="true" dynamic="false"/>
    </actors>
</level>